{
  "$schema": "https://json-schema.org/draft/2020-12/schema",
  "$id": "https://open-ai-gateway.local/schema/config.schema.json",
  "title": "open-ai-gateway config",
  "type": "object",
  "additionalProperties": false,
  "properties": {
    "addr": {
      "type": "string",
      "description": "HTTP listen address in host:port format."
    },
    "api_key": {
      "type": "string",
      "description": "Gateway API key for client Bearer auth."
    },
    "api_keys": {
      "type": "array",
      "description": "Gateway API keys for client Bearer auth.",
      "items": {
        "type": "string",
        "minLength": 1
      },
      "uniqueItems": true
    },
    "api_clients": {
      "type": "array",
      "description": "Named gateway API keys for client Bearer auth, observability labels, model allowlists, and rate limit overrides.",
      "items": {
        "$ref": "#/$defs/api_client"
      }
    },
    "request_timeout_seconds": {
      "type": "integer",
      "minimum": 0
    },
    "stream_timeout_seconds": {
      "type": "integer",
      "minimum": 0
    },
    "read_header_timeout_seconds": {
      "type": "integer",
      "minimum": 0
    },
    "read_timeout_seconds": {
      "type": "integer",
      "minimum": 0
    },
    "write_timeout_seconds": {
      "type": "integer",
      "minimum": 0
    },
    "idle_timeout_seconds": {
      "type": "integer",
      "minimum": 0
    },
    "shutdown_timeout_seconds": {
      "type": "integer",
      "minimum": 0
    },
    "max_request_body_bytes": {
      "type": "integer",
      "minimum": 0
    },
    "log": {
      "$ref": "#/$defs/log"
    },
    "audit": {
      "$ref": "#/$defs/audit"
    },
    "rate_limit": {
      "$ref": "#/$defs/rate_limit"
    },
    "provider_health": {
      "$ref": "#/$defs/provider_health"
    },
    "response_store": {
      "$ref": "#/$defs/response_store"
    },
    "providers": {
      "type": "object",
      "minProperties": 1,
      "additionalProperties": {
        "$ref": "#/$defs/provider"
      }
    },
    "models": {
      "type": "object",
      "minProperties": 1,
      "additionalProperties": {
        "$ref": "#/$defs/model"
      }
    }
  },
  "required": [
    "providers",
    "models"
  ],
  "$defs": {
    "api_client": {
      "type": "object",
      "additionalProperties": false,
      "properties": {
        "name": {
          "type": "string",
          "minLength": 1
        },
        "api_key": {
          "type": "string",
          "minLength": 1
        },
        "models": {
          "type": "array",
          "description": "External model IDs visible to this gateway client. Empty or omitted means all models.",
          "items": {
            "type": "string",
            "minLength": 1
          },
          "uniqueItems": true
        },
        "rate_limit": {
          "description": "Per-client rate limit override. requests_per_minute=0 disables limiting for this client.",
          "$ref": "#/$defs/rate_limit"
        }
      },
      "required": ["name", "api_key"]
    },
    "log": {
      "type": "object",
      "additionalProperties": false,
      "properties": {
        "format": {
          "type": "string",
          "enum": ["text", "json"]
        },
        "level": {
          "type": "string",
          "enum": ["debug", "info", "warn", "error"]
        }
      }
    },
    "audit": {
      "type": "object",
      "description": "Local JSONL audit capture for agent research. Disabled by default and may record full request and response bodies when enabled.",
      "additionalProperties": false,
      "properties": {
        "enabled": {
          "type": "boolean",
          "default": false
        },
        "path": {
          "type": "string",
          "minLength": 1,
          "default": "audit/agent-trace.jsonl"
        },
        "max_file_bytes": {
          "type": "integer",
          "minimum": 0,
          "default": 0
        }
      }
    },
    "rate_limit": {
      "type": "object",
      "description": "Simple in-memory fixed-window request rate limit.",
      "additionalProperties": false,
      "properties": {
        "requests_per_minute": {
          "type": "integer",
          "description": "Allowed requests per minute. 0 disables rate limiting.",
          "minimum": 0
        }
      }
    },
    "provider_health": {
      "type": "object",
      "additionalProperties": false,
      "properties": {
        "failure_threshold": {
          "type": "integer",
          "minimum": 0
        },
        "cooldown_seconds": {
          "type": "integer",
          "minimum": 0
        }
      }
    },
    "response_store": {
      "type": "object",
      "description": "Bounded in-memory storage for Responses previous_response_id continuation. Any zero value disables the store.",
      "additionalProperties": false,
      "properties": {
        "ttl_seconds": { "type": "integer", "minimum": 0 },
        "max_entries": { "type": "integer", "minimum": 0 },
        "max_context_bytes": { "type": "integer", "minimum": 0 },
        "max_total_bytes": { "type": "integer", "minimum": 0 }
      },
      "required": ["ttl_seconds", "max_entries", "max_context_bytes", "max_total_bytes"]
    },
    "provider": {
      "type": "object",
      "additionalProperties": false,
      "properties": {
        "type": {
          "type": "string",
          "enum": ["fake", "openai-compatible", "azure-openai"]
        },
        "base_url": {
          "type": "string",
          "format": "uri"
        },
        "api_key": {
          "type": "string"
        },
        "api_key_env": {
          "type": "string"
        },
        "api_version": {
          "type": "string",
          "description": "Azure OpenAI api-version query value. Required for azure-openai providers."
        },
        "timeout_seconds": {
          "type": "integer",
          "minimum": 0
        }
      },
      "required": ["type"]
    },
    "model": {
      "type": "object",
      "additionalProperties": false,
      "properties": {
        "provider": {
          "type": "string"
        },
        "upstream_model": {
          "type": "string"
        },
        "capabilities": {
          "type": "array",
          "items": {
            "type": "string",
            "enum": ["chat", "completions", "embeddings", "images", "moderations", "transcriptions", "translations", "speech", "batches", "files", "fine_tuning"]
          },
          "uniqueItems": true
        },
        "pricing": {
          "$ref": "#/$defs/pricing"
        },
        "fallbacks": {
          "type": "array",
          "items": {
            "$ref": "#/$defs/model_fallback"
          }
        }
      },
      "required": ["provider"]
    },
    "model_fallback": {
      "type": "object",
      "additionalProperties": false,
      "properties": {
        "provider": {
          "type": "string"
        },
        "upstream_model": {
          "type": "string"
        },
        "pricing": {
          "$ref": "#/$defs/pricing"
        }
      },
      "required": ["provider"]
    },
    "pricing": {
      "type": "object",
      "additionalProperties": false,
      "properties": {
        "prompt_usd_per_1m_tokens": {
          "type": "number",
          "minimum": 0
        },
        "completion_usd_per_1m_tokens": {
          "type": "number",
          "minimum": 0
        }
      }
    }
  }
}
