{
  "addr": "127.0.0.1:8080",
  "api_key": "test-gateway-key",
  "request_timeout_seconds": 60,
  "stream_timeout_seconds": 600,
  "read_header_timeout_seconds": 10,
  "read_timeout_seconds": 0,
  "write_timeout_seconds": 0,
  "idle_timeout_seconds": 120,
  "shutdown_timeout_seconds": 10,
  "rate_limit": {
    "requests_per_minute": 0
  },
  "providers": {
    "local": {
      "type": "openai-compatible",
      "base_url": "http://127.0.0.1:8000/v1",
      "api_key": "local-dev-key",
      "timeout_seconds": 60
    }
  },
  "models": {
    "local-model": {
      "provider": "local",
      "upstream_model": "local-model",
      "capabilities": ["chat"]
    },
    "local-embedding-model": {
      "provider": "local",
      "upstream_model": "local-embedding-model",
      "capabilities": ["embeddings"]
    }
  }
}
