{
  "addr": "127.0.0.1:8080",
  "api_key": "test-gateway-key",
  "request_timeout_seconds": 60,
  "stream_timeout_seconds": 600,
  "read_header_timeout_seconds": 10,
  "read_timeout_seconds": 0,
  "write_timeout_seconds": 0,
  "idle_timeout_seconds": 120,
  "shutdown_timeout_seconds": 10,
  "max_request_body_bytes": 1048576,
  "log": {
    "format": "json",
    "level": "info"
  },
  "providers": {
    "azure": {
      "type": "azure-openai",
      "base_url": "https://your-resource.openai.azure.com",
      "api_key_env": "AZURE_OPENAI_API_KEY",
      "api_version": "2024-02-15-preview",
      "timeout_seconds": 60
    }
  },
  "models": {
    "gpt-4o-mini": {
      "provider": "azure",
      "upstream_model": "your-chat-deployment",
      "capabilities": ["chat"]
    },
    "text-embedding-3-small": {
      "provider": "azure",
      "upstream_model": "your-embedding-deployment",
      "capabilities": ["embeddings"]
    }
  }
}
